{
  "score_id": "score-001",
  "paper_id": "paper-001",
  "rubric_version": "v1",
  "dimensions": {
    "capability_overlap": {
      "score": 3,
      "uncertainty": 0.2,
      "rationale": "Moderate transfer to capabilities.",
      "evidence": [
        {
          "citation_id": "citation-123",
          "snippet": "This method improved training stability.",
          "locator": "p. 4"
        }
      ]
    }
  },
  "provenance": {
    "method": "human",
    "created_at": "2025-01-10T12:00:00Z",
    "notes": "Initial scoring pass."
  }
}
